<?xml version="1.0" encoding="UTF-8"?>

<?xml-stylesheet type="text/xsl" href="recipe-style.xsl"?>

<recipe xmlns="http://www.example.com/recipe" 
xmlns:xsi="http://www.w3.org/2001/XMLSchema-instance"
xsi:schemaLocation="recipe.xsd"
id="vegetable-curry">

  <title>Creamy Vegetable Curry</title>

  <description>
    <summary>A fragrant and creamy vegetable curry made with coconut milk, aromatic spices, and fresh vegetables. This vegetarian dish is flavorful, satisfying, and naturally gluten-free.</summary>
    <tags>
      <tag>vegetarian</tag>
      <tag>indian</tag>
      <tag>curry</tag>
      <tag>dinner</tag>
      <tag>gluten-free</tag>
    </tags>
  </description>

  <metadata>
    <servings>4</servings>
    <prepTime>20 minutes</prepTime>
    <cookTime>30 minutes</cookTime>
    <totalTime>50 minutes</totalTime>
    <difficulty>medium</difficulty>
  </metadata>

  <ingredients>
    <ingredient quantity="2" unit="tablespoons">coconut oil</ingredient>
    <ingredient quantity="1" unit="large">onion, diced</ingredient>
    <ingredient quantity="3" unit="cloves">garlic, minced</ingredient>
    <ingredient quantity="1" unit="tablespoon">fresh ginger, minced</ingredient>
    <ingredient quantity="2" unit="tablespoons">curry powder</ingredient>
    <ingredient quantity="1" unit="teaspoon">turmeric</ingredient>
    <ingredient quantity="2" unit="cups">cauliflower florets</ingredient>
    <ingredient quantity="2" unit="cups">diced potatoes</ingredient>
    <ingredient quantity="1" unit="cup">carrots, sliced</ingredient>
    <ingredient quantity="1" unit="can (14 oz)">coconut milk</ingredient>
    <ingredient quantity="1" unit="cup">vegetable broth</ingredient>
    <ingredient quantity="1" unit="count">lime, juiced</ingredient>
    <ingredient quantity="1/4" unit="cup">fresh cilantro, chopped</ingredient>
    <ingredient quantity="1" unit="teaspoon">salt</ingredient>
  </ingredients>

  <preparation>
    <step number="1">Heat coconut oil in a large pot over medium heat.</step>
    <step number="2">Add diced onion and cook until softened, about 5 minutes.</step>
    <step number="3">Stir in minced garlic and ginger, cook for 30 seconds until fragrant.</step>
    <step number="4">Add curry powder and turmeric, stir well to coat vegetables, cook for 1 minute.</step>
    <step number="5">Add cauliflower, potatoes, and carrots. Stir to combine with the spice mixture.</step>
    <step number="6">Pour in coconut milk and vegetable broth. Bring to a simmer.</step>
    <step number="7">Reduce heat to medium-low and simmer uncovered for 20-25 minutes until vegetables are tender.</step>
    <step number="8">Stir in lime juice and season with salt to taste.</step>
    <step number="9">Serve hot over rice, garnished with fresh cilantro.</step>
  </preparation>

</recipe>
