<?xml version="1.0" encoding="UTF-8"?>
<?xml-stylesheet type="text/xsl" href="recipe-style.xsl"?>

<recipe xmlns="http://www.example.com/recipe" 
xmlns:xsi="http://www.w3.org/2001/XMLSchema-instance"
xsi:schemaLocation="recipe.xsd"
id="instant-pot-cheesy-cauliflower-potato-soup">

  <title>Instant Pot Cheesy Cauliflower Potato Soup</title>

  <description>
    <summary>Easy gluten-free one-pot Instant Pot dinner — creamy potato, cheese, and bacon with cauliflower for fiber and a lighter bowl.</summary>
    <tags>
      <tag>easy</tag>
      <tag>instant-pot</tag>
      <tag>soup</tag>
      <tag>gluten-free</tag>
      <tag>potato</tag>
      <tag>cauliflower</tag>
      <tag>main-course</tag>
      <tag>weeknight</tag>
    </tags>
  </description>

  <metadata>
    <servings>8</servings>
    <prepTime>30 minutes</prepTime>
    <cookTime>30 minutes</cookTime>
    <totalTime>1 hour</totalTime>
    <difficulty>easy</difficulty>
  </metadata>

  <source url="https://www.homemadefoodjunkie.com/instant-pot-cheesy-cauliflower-potato-soup/">Homemade Food Junkie</source>

  <category>soup</category>

  <ingredients>
    <ingredient quantity="1" unit="pound">potatoes (yellow or white), peeled, cored, cut into ~2-inch chunks</ingredient>
    <ingredient quantity="1" unit="medium head">cauliflower, leaves removed, chopped into large chunks</ingredient>
    <ingredient quantity="1/2" unit="lb">bacon, chopped (or low-sodium substitute); reserve some for garnish</ingredient>
    <ingredient quantity="4" unit="cloves">garlic, finely chopped</ingredient>
    <ingredient quantity="4" unit="cups">chicken broth</ingredient>
    <ingredient quantity="1" unit="cup">whole milk</ingredient>
    <ingredient quantity="1/2" unit="tsp">pepper</ingredient>
    <ingredient quantity="1 1/2" unit="cup">grated cheddar cheese</ingredient>
  </ingredients>

  <preparation>
    <step number="1">Set Instant Pot to SAUTE (use + adjust as needed).</step>
    <step number="2">Add bacon and garlic; cook ~4 minutes until bacon lightly browned. Cook enough bacon to reserve some for garnish if desired.</step>
    <step number="3">Drain grease; set aside garnish bacon.</step>
    <step number="4">Add potatoes, cauliflower, and chicken stock. Seal lid/vent.</step>
    <step number="5">MANUAL high pressure 10 minutes. Turn pot off.</step>
    <step number="6">Natural release 10 minutes, then quick release until fully depressurized.</step>
    <step number="7">Add milk and 1 1/4 cup cheese. Mash with potato masher or immersion blender to desired consistency; add more broth if needed.</step>
    <step number="8">Serve topped with remaining cheese and bacon crumbles.</step>
  </preparation>

</recipe>
