<?xml version="1.0" encoding="UTF-8"?>
<?xml-stylesheet type="text/xsl" href="recipe-style.xsl"?>

<recipe xmlns="http://www.example.com/recipe" 
xmlns:xsi="http://www.w3.org/2001/XMLSchema-instance"
xsi:schemaLocation="recipe.xsd"
id="slow-cooker-asian-sesame-chicken">

  <title>Slow Cooker Asian Sesame Chicken</title>

  <description>
    <summary>Slow Cooker Asian Sesame Chicken is an easy, dump & go 4-ingredient chicken recipe made in the slow cooker. Sweet, savory, and perfect for busy weeknights or weekend meal prep. Serve over rice, quinoa, or noodles for a complete meal. Great base for lunches throughout the week.</summary>
    <tags>
      <tag>easy</tag>
      <tag>crockpot</tag>
      <tag>chicken</tag>
      <tag>asian</tag>
      <tag>main-course</tag>
      <tag>meal-prep</tag>
      <tag>weekend-batch</tag>
    </tags>
  </description>

  <metadata>
    <servings>6</servings>
    <prepTime>5 minutes</prepTime>
    <cookTime>6-8 hours</cookTime>
    <totalTime>6-8 hours</totalTime>
    <difficulty>easy</difficulty>
  </metadata>

  <source url="https://togetherasfamily.com/slow-cooker-asian-sesame-chicken/">Together as Family</source>

  <ingredients>
    <ingredient quantity="4" unit="boneless, skinless">chicken breasts (about 2 lbs)</ingredient>
    <ingredient quantity="1" unit="bottle (16 oz)">Asian toasted sesame dressing (Kraft or similar)</ingredient>
    <ingredient quantity="1/3" unit="cup">apricot preserves (or sugar-free)</ingredient>
    <ingredient quantity="1" unit="packet (1 oz)">onion soup mix</ingredient>
    <ingredient quantity="" unit="optional">chopped green onions and sesame seeds for garnish</ingredient>
  </ingredients>

  <preparation>
    <step number="1">Spray slow cooker insert with cooking spray. Lay chicken breasts in the bottom (cut large ones in half if needed).</step>
    <step number="2">In a bowl, mix together the Asian sesame dressing, apricot preserves, and onion soup mix packet. Stir with a fork until combined.</step>
    <step number="3">Pour the sauce mixture evenly over the chicken in the crockpot.</step>
    <step number="4">Cover and cook on low for 6-8 hours until chicken is tender and cooked through.</step>
    <step number="5">Shred or slice the chicken and return to the sauce. Stir to coat.</step>
    <step number="6">Serve over cooked rice, quinoa, noodles, or cauliflower rice. Drizzle with extra sauce and garnish with green onions and sesame seeds if desired.</step>
    <step number="7">For meal prep: Portion into containers with rice/quinoa for easy weekday lunches. Stores well in fridge 4-5 days or freeze.</step>
  </preparation>

</recipe>

