<?xml version="1.0" encoding="UTF-8"?>

<?xml-stylesheet type="text/xsl" href="recipe-style.xsl"?>

<recipe xmlns="http://www.example.com/recipe" 
xmlns:xsi="http://www.w3.org/2001/XMLSchema-instance"
xsi:schemaLocation="recipe.xsd"
id="chicken-tikka-masala">

  <title>Chicken Tikka Masala</title>

  <description>
    <summary>A creamy and aromatic Indian chicken dish made with tender chicken in a rich tomato-based sauce with warming spices. Serve with rice or naan bread for an authentic experience.</summary>
    <tags>
      <tag>indian</tag>
      <tag>curry</tag>
      <tag>dinner</tag>
      <tag>main-course</tag>
      <tag>spicy</tag>
    </tags>
  </description>

  <metadata>
    <servings>4</servings>
    <prepTime>30 minutes</prepTime>
    <cookTime>40 minutes</cookTime>
    <totalTime>70 minutes</totalTime>
    <difficulty>medium</difficulty>
  </metadata>

  <ingredients>
    <ingredient quantity="2" unit="lbs">chicken breasts, cubed</ingredient>
    <ingredient quantity="1" unit="cup">plain yogurt</ingredient>
    <ingredient quantity="3" unit="tablespoons">garam masala</ingredient>
    <ingredient quantity="2" unit="tablespoons">cumin</ingredient>
    <ingredient quantity="3" unit="tablespoons">paprika</ingredient>
    <ingredient quantity="3" unit="tablespoons">olive oil</ingredient>
    <ingredient quantity="1" unit="large">onion, diced</ingredient>
    <ingredient quantity="6" unit="cloves">garlic, minced</ingredient>
    <ingredient quantity="2" unit="tablespoons">fresh ginger, minced</ingredient>
    <ingredient quantity="2" unit="cans (15 oz)">crushed tomatoes</ingredient>
    <ingredient quantity="1" unit="can (14 oz)">coconut milk</ingredient>
    <ingredient quantity="2" unit="tablespoons">tomato paste</ingredient>
    <ingredient quantity="1" unit="count">lime, juiced</ingredient>
    <ingredient quantity="1/4" unit="cup">fresh cilantro, chopped</ingredient>
    <ingredient quantity="1" unit="teaspoon">salt</ingredient>
  </ingredients>

  <preparation>
    <step number="1">In a bowl, combine 1/2 cup yogurt, 1 tablespoon garam masala, 1 tablespoon cumin, and 2 tablespoons paprika. Add chicken pieces and marinate for at least 20 minutes.</step>
    <step number="2">Heat 2 tablespoons olive oil in a large skillet over medium-high heat. Working in batches, cook marinated chicken until golden, about 5-7 minutes per batch. Set aside.</step>
    <step number="3">In the same skillet, heat remaining 1 tablespoon olive oil over medium heat.</step>
    <step number="4">Add diced onion and cook until softened, about 5 minutes.</step>
    <step number="5">Add minced garlic and ginger, cook for 1 minute until fragrant.</step>
    <step number="6">Stir in remaining spices (2 tablespoons garam masala, 1 tablespoon cumin, 1 tablespoon paprika) and tomato paste. Cook for 1-2 minutes.</step>
    <step number="7">Add crushed tomatoes and bring to a simmer. Cook for 5 minutes.</step>
    <step number="8">Stir in coconut milk and cooked chicken. Reduce heat to low and simmer for 20-25 minutes, stirring occasionally.</step>
    <step number="9">Stir in remaining 1/2 cup yogurt and lime juice. Heat through without boiling.</step>
    <step number="10">Season with salt to taste and serve hot over rice or with naan, garnished with fresh cilantro.</step>
  </preparation>

</recipe>
